{
  "schema_version": 1,
  "slug": "ftpk-season-4-166usdc",
  "title": "FTPK Season 4: Something in Common",
  "tier": "mid",
  "status": "open",
  "dead_end_reason": null,
  "series": "ftpk",
  "author": {
    "name": "FTPKgame",
    "handles": ["x:@FTPKgame"],
    "url": "https://x.com/FTPKgame"
  },
  "published": { "date": "2026-07-16", "url": "https://x.com/FTPKgame/status/2077755138668671313" },
  "chain": "ethereum",
  "prize": {
    "amount": 168.0,
    "asset": "USDC",
    "usd_estimate": 168,
    "usd_snapshot": "2026-08-16",
    "note": "the author tops up this prize over time; it started at 153 USDC and has grown one dollar at a time, plus a small native ETH gas preload for the eventual winner"
  },
  "addresses": [
    {
      "address": "0xa468335485cE853F21A44451755bd88364e9d618",
      "chain": "ethereum",
      "role": "escrow",
      "label": "main",
      "explorer": "https://etherscan.io/address/0xa468335485cE853F21A44451755bd88364e9d618",
      "expected": "168.000000 USDC",
      "token": {
        "standard": "erc20",
        "contract": "0xA0b86991c6218b36c1d19D4a2e9Eb0cE3606eB48",
        "decimals": 6,
        "symbol": "USDC",
        "contract_explorer": "https://etherscan.io/token/0xA0b86991c6218b36c1d19D4a2e9Eb0cE3606eB48"
      },
      "verified_on": "2026-08-16",
      "verified_state": "funded-unspent"
    }
  ],
  "puzzle_type": ["bip39-seed", "word-selection"],
  "target_format": "12 English BIP39 words, BIP44 Ethereum m/44'/60'/0'/0/0, no passphrase, order recoverable offline once the word set is known",
  "derivation": {
    "summary": "solve each of 12 independent mini-games to get one BIP39 word each, then derive the standard BIP44 first Ethereum address and compare it to the escrow",
    "oracle": "tools/oracle.py",
    "oracle_certified": true,
    "certified_against": "the public BIP39/BIP44 test mnemonic (12x 'abandon' plus 'about'); no author-published worked example exists for this season"
  },
  "difficulty_left": "insight",
  "difficulty_note": "the derivation is certified and the site is fully mirrored; the author's own hint says most games share a common mechanic, likely a number used as a 1-2048 BIP39 index; 1 word is established with confidence (game 1) and a 2nd is a strong candidate (game 10)",
  "leads": [
    { "rank": 1, "title": "identify the common mechanic across the 12 games (most likely: each yields a number used as a BIP39 wordlist index)", "cost": "hours", "status": "open" },
    { "rank": 2, "title": "solve the remaining games directly; the word order is a minor convenience, not a real lock, once the word set is known", "cost": "hours", "status": "open" }
  ],
  "solutions": [],
  "artifacts": [],
  "sources": [
    { "title": "\"A new treasure hunt is live! (Something in common), 12 hidden words, 150 USDC to be won\"", "url": "https://x.com/FTPKgame/status/2077755138668671313", "date": "2026-07-16", "archived": null },
    { "title": "\"Yes, all the words are necessarily part of the BIP-39 list\"", "url": "https://x.com/FTPKgame/status/2080258068529492034", "date": "2026-07-23", "archived": null },
    { "title": "\"There is something that almost all the games have in common\"", "url": "https://x.com/FTPKgame/status/2080976765401387082", "date": "2026-07-25", "archived": null },
    { "title": "\"In Season 4, there is a hidden page to help you with Season 2\"", "url": "https://x.com/FTPKgame/status/2079947035357102350", "date": "2026-07-22", "archived": null },
    { "title": "FTPK hub page", "url": "https://findtheprivatekeys.vercel.app/", "date": "2026-08-16", "archived": null },
    { "title": "Season 4 puzzle site", "url": "https://findtheprivatekeys4.vercel.app/", "date": "2026-08-16", "archived": null },
    { "title": "Escrow wallet, etherscan.io", "url": "https://etherscan.io/address/0xa468335485cE853F21A44451755bd88364e9d618", "date": "2026-08-16", "archived": null }
  ],
  "third_party_material": "no images, audio, or video shipped; only short quoted author text and the site's own rule text are included",
  "last_updated": "2026-08-16"
}
